Microsoft Windows [版本 10.0.16299.15]
(c) 2017 Microsoft Corporation。保留所有权利。

C:\Windows\system32>net start mysql80
请求的服务已经启动。

请键入 NET HELPMSG 2182 以获得更多的帮助。


C:\Windows\system32>mysql -u root -p
Enter password: ******
ERROR 1045 (28000): Access denied for user 'root'@'localhost' (using password: YES)

C:\Windows\system32>mysql -u root -p
Enter password: *******
Welcome to the MySQL monitor.  Commands end with ; or \g.
Your MySQL connection id is 28
Server version: 8.0.12 MySQL Community Server - GPL

Copyright (c) 2000, 2018, Oracle and/or its affiliates. All rights reserved.

Oracle is a registered trademark of Oracle Corporation and/or its
affiliates. Other names may be trademarks of their respective
owners.

Type 'help;' or '\h' for help. Type '\c' to clear the current input statement.

mysql> show tables;
ERROR 1046 (3D000): No database selected
mysql> show databases;
+--------------------+
| Database           |
+--------------------+
| information_schema |
| mysql              |
| new_schema         |
| performance_schema |
| shopping           |
| zhaoyichen         |
+--------------------+
6 rows in set (0.10 sec)

mysql> use zhaoyichen;
Database changed
mysql> create table collect(id int primary key auto_increment not null,collect varchar(15) not null,name varchar(20) not null,price varchar(5) not null);
Query OK, 0 rows affected (0.51 sec)

mysql> desc collect;
+---------+-------------+------+-----+---------+----------------+
| Field   | Type        | Null | Key | Default | Extra          |
+---------+-------------+------+-----+---------+----------------+
| id      | int(11)     | NO   | PRI | NULL    | auto_increment |
| collect | varchar(15) | NO   |     | NULL    |                |
| name    | varchar(20) | NO   |     | NULL    |                |
| price   | varchar(5)  | NO   |     | NULL    |                |
+---------+-------------+------+-----+---------+----------------+
4 rows in set (0.00 sec)

mysql> create table collect(id int primary key auto_increment not null,yonghuid int(15) collect varchar(15) not null,name varchar(20) not null,price varchar(5) not null);
ERROR 1064 (42000): You have an error in your SQL syntax; check the manual that corresponds to your MySQL server version for the right syntax to use near 'collect varchar(15) not null,name varchar(20) not null,price varchar(5) not null' at line 1
mysql> create table collect(id int primary key auto_increment not null,yonghuid int(15),collect varchar(15) not null,name varchar(20) not null,price varchar(5) not null);
ERROR 1050 (42S01): Table 'collect' already exists
mysql> drop collect;
ERROR 1064 (42000): You have an error in your SQL syntax; check the manual that corresponds to your MySQL server version for the right syntax to use near 'collect' at line 1
mysql> drop table collect;
Query OK, 0 rows affected (0.55 sec)

mysql> create table collect(id int primary key auto_increment not null,yonghuid int(15),collect varchar(15) not null,name varchar(20) not null,price varchar(5) not null);
Query OK, 0 rows affected (0.52 sec)

mysql> desc collect;
+----------+-------------+------+-----+---------+----------------+
| Field    | Type        | Null | Key | Default | Extra          |
+----------+-------------+------+-----+---------+----------------+
| id       | int(11)     | NO   | PRI | NULL    | auto_increment |
| yonghuid | int(15)     | YES  |     | NULL    |                |
| collect  | varchar(15) | NO   |     | NULL    |                |
| name     | varchar(20) | NO   |     | NULL    |                |
| price    | varchar(5)  | NO   |     | NULL    |                |
+----------+-------------+------+-----+---------+----------------+
5 rows in set (0.00 sec)

mysql> insert into collect(yonghuid,collect,name,price)values(201707104011,201707104012),('yes','no'),('zhaoyichen','zhangxuejing'),('100','200');
ERROR 1136 (21S01): Column count doesn't match value count at row 1
mysql> insert into collect(yonghuid,collect,name,price)values(201707104011,201707104012),('yes','no'),('zhaoyichen','zhangxuejing'),('100','200');
ERROR 1136 (21S01): Column count doesn't match value count at row 1
mysql> insert into collect(yonghuid,collect,name,price)values(201707104011),('yes'),('zhaoyichen'),('100');
ERROR 1136 (21S01): Column count doesn't match value count at row 1
mysql> insert into collect(yonghuid)values(201707104011,201707104012);
ERROR 1136 (21S01): Column count doesn't match value count at row 1
mysql> select * from collect;
Empty set (0.00 sec)

mysql> insert into collect(yonghuid)values(201707104011,201707104012);
ERROR 1136 (21S01): Column count doesn't match value count at row 1
mysql> insert into collect(yonghuid)values(201707104011);
ERROR 1264 (22003): Out of range value for column 'yonghuid' at row 1
mysql> insert into collect(yonghuid)values(2017);
ERROR 1364 (HY000): Field 'collect' doesn't have a default value
mysql> insert into collect(yonghu)values(2017);
ERROR 1054 (42S22): Unknown column 'yonghu' in 'field list'
mysql> insert into collect(yonghuid)values('2017');
ERROR 1364 (HY000): Field 'collect' doesn't have a default value
mysql> insert into collect(yonghuid,collect,name,price)values(2017,2018),('yes','no'),('zhaoyichen','zhangxuejing'),('100','200');
ERROR 1136 (21S01): Column count doesn't match value count at row 1
mysql> insert into collect(yonghuid)values(2017),(2018);
ERROR 1364 (HY000): Field 'collect' doesn't have a default value
mysql> insert into collect(yonghuid,collect,name,price) values(2017,2018),('yes','no'),('zhaoyichen','zhangxuejing'),('100','200');
ERROR 1136 (21S01): Column count doesn't match value count at row 1
mysql> insert into collect(yonghuid,collect,name,price) values(2017,'yes','zhaoyichen','200');
Query OK, 1 row affected (0.21 sec)

mysql> select * from collect;
+----+----------+---------+------------+-------+
| id | yonghuid | collect | name       | price |
+----+----------+---------+------------+-------+
|  1 |     2017 | yes     | zhaoyichen | 200   |
+----+----------+---------+------------+-------+
1 row in set (0.00 sec)

mysql> alter table collect add wupinname varchar(6);
Query OK, 0 rows affected (0.64 sec)
Records: 0  Duplicates: 0  Warnings: 0

mysql> insert into collect(wupinname) values('yifu');
ERROR 1364 (HY000): Field 'collect' doesn't have a default value
mysql> select * from collect;
+----+----------+---------+------------+-------+-----------+
| id | yonghuid | collect | name       | price | wupinname |
+----+----------+---------+------------+-------+-----------+
|  1 |     2017 | yes     | zhaoyichen | 200   | NULL      |
+----+----------+---------+------------+-------+-----------+
1 row in set (0.00 sec)

mysql> alter table collect change wupinname where id=1;
ERROR 1064 (42000): You have an error in your SQL syntax; check the manual that corresponds to your MySQL server version for the right syntax to use near 'where id=1' at line 1
mysql> upset collect set wupinname=null where id=1;
ERROR 1064 (42000): You have an error in your SQL syntax; check the manual that corresponds to your MySQL server version for the right syntax to use near 'upset collect set wupinname=null where id=1' at line 1
mysql> update collect set wupinname=null where id=1;
Query OK, 0 rows affected (0.00 sec)
Rows matched: 1  Changed: 0  Warnings: 0

mysql> select * from collect;
+----+----------+---------+------------+-------+-----------+
| id | yonghuid | collect | name       | price | wupinname |
+----+----------+---------+------------+-------+-----------+
|  1 |     2017 | yes     | zhaoyichen | 200   | NULL      |
+----+----------+---------+------------+-------+-----------+
1 row in set (0.00 sec)

mysql> upset collect set wupinname=yifu where id=1;
ERROR 1064 (42000): You have an error in your SQL syntax; check the manual that corresponds to your MySQL server version for the right syntax to use near 'upset collect set wupinname=yifu where id=1' at line 1
mysql> upset collect set wupinname='yifu' where id=1;
ERROR 1064 (42000): You have an error in your SQL syntax; check the manual that corresponds to your MySQL server version for the right syntax to use near 'upset collect set wupinname='yifu' where id=1' at line 1
mysql> update collect set wupinname='yifu' where id=1;
Query OK, 1 row affected (0.13 sec)
Rows matched: 1  Changed: 1  Warnings: 0

mysql> select * from collect;
+----+----------+---------+------------+-------+-----------+
| id | yonghuid | collect | name       | price | wupinname |
+----+----------+---------+------------+-------+-----------+
|  1 |     2017 | yes     | zhaoyichen | 200   | yifu      |
+----+----------+---------+------------+-------+-----------+
1 row in set (0.00 sec)

mysql> insert into collect(yonghuid,collect,name,price,wupinmingchen) values(2017,'yes','zhangxuejing','100','kuzi');
ERROR 1054 (42S22): Unknown column 'wupinmingchen' in 'field list'
mysql> insert into collect(yonghuid,collect,name,price,wupinminname) values(2017,'yes','zhangxuejing','100','kuzi');
ERROR 1054 (42S22): Unknown column 'wupinminname' in 'field list'
mysql> insert into collect(yonghuid,collect,name,price,wupinname) values(2017,'yes','zhangxuejing','100','kuzi');
Query OK, 1 row affected (0.23 sec)

mysql> select * from collect;
+----+----------+---------+--------------+-------+-----------+
| id | yonghuid | collect | name         | price | wupinname |
+----+----------+---------+--------------+-------+-----------+
|  1 |     2017 | yes     | zhaoyichen   | 200   | yifu      |
|  2 |     2017 | yes     | zhangxuejing | 100   | kuzi      |
+----+----------+---------+--------------+-------+-----------+
2 rows in set (0.00 sec)

mysql> insert into collect(yonghuid,collect,name,price,wupinname) values(2018,'yes','zhangxuejing','100','kuzi');
Query OK, 1 row affected (0.20 sec)

mysql> select * from collect;
+----+----------+---------+--------------+-------+-----------+
| id | yonghuid | collect | name         | price | wupinname |
+----+----------+---------+--------------+-------+-----------+
|  1 |     2017 | yes     | zhaoyichen   | 200   | yifu      |
|  2 |     2017 | yes     | zhangxuejing | 100   | kuzi      |
|  3 |     2018 | yes     | zhangxuejing | 100   | kuzi      |
+----+----------+---------+--------------+-------+-----------+
3 rows in set (0.00 sec)

mysql> delect from collect collect where id=2;
ERROR 1064 (42000): You have an error in your SQL syntax; check the manual that corresponds to your MySQL server version for the right syntax to use near 'delect from collect collect where id=2' at line 1
mysql> delect from collect where id=2;
ERROR 1064 (42000): You have an error in your SQL syntax; check the manual that corresponds to your MySQL server version for the right syntax to use near 'delect from collect where id=2' at line 1
mysql> delect from collect where id='2';
ERROR 1064 (42000): You have an error in your SQL syntax; check the manual that corresponds to your MySQL server version for the right syntax to use near 'delect from collect where id='2'' at line 1
mysql> update collect set collect='no' where id=1;
Query OK, 1 row affected (0.29 sec)
Rows matched: 1  Changed: 1  Warnings: 0

mysql> select * from collect;
+----+----------+---------+--------------+-------+-----------+
| id | yonghuid | collect | name         | price | wupinname |
+----+----------+---------+--------------+-------+-----------+
|  1 |     2017 | no      | zhaoyichen   | 200   | yifu      |
|  2 |     2017 | yes     | zhangxuejing | 100   | kuzi      |
|  3 |     2018 | yes     | zhangxuejing | 100   | kuzi      |
+----+----------+---------+--------------+-------+-----------+
3 rows in set (0.00 sec)

mysql> select * like '%fu';
ERROR 1064 (42000): You have an error in your SQL syntax; check the manual that corresponds to your MySQL server version for the right syntax to use near 'like '%fu'' at line 1
mysql> select collect like '%fu';
ERROR 1054 (42S22): Unknown column 'collect' in 'field list'
mysql> select wupinname like '%fu';
ERROR 1054 (42S22): Unknown column 'wupinname' in 'field list'
mysql> select yifu like '%fu';
ERROR 1054 (42S22): Unknown column 'yifu' in 'field list'
mysql> select * like '%fu' where wupinname;
ERROR 1064 (42000): You have an error in your SQL syntax; check the manual that corresponds to your MySQL server version for the right syntax to use near 'like '%fu' where wupinname' at line 1
mysql> select collect like '%fu' where wupinname;
ERROR 1054 (42S22): Unknown column 'collect' in 'field list'
mysql> select wupinnanme from collect where wupinname like '%yi%';
ERROR 1054 (42S22): Unknown column 'wupinnanme' in 'field list'
mysql> select wupinname from collect where wupinname like '%yi%';
+-----------+
| wupinname |
+-----------+
| yifu      |
+-----------+
1 row in set (0.10 sec)

mysql> select yonghuid from collect where yonghuid like '%18%';
+----------+
| yonghuid |
+----------+
|     2018 |
+----------+
1 row in set (0.00 sec)